{
  "$comment": "BEISPIEL-INSTANZ — Schema: schemas/agent-state.schema.json. Im Zielprojekt nach runtime/.agent-state.json kopieren.",
  "schema_version": "1.3.1",
  "orchestrator_id": "00000000-0000-4000-8000-000000000001",
  "original_user_prompt": "Beispiel: Implementiere Benutzer-Login mit OAuth2",
  "phase": "bootstrapping",
  "cfg": {
    "active_node": 1,
    "active_node_name": "N1_context_ingestion",
    "completed_nodes": [0],
    "track": "undecided"
  },
  "triage": {
    "decision": "pending",
    "rationale": "Triage erfolgt nach Abschluss von N1 (Bootstrap)",
    "complexity_score": 5,
    "signals": []
  },
  "tree": {
    "current_depth": 0,
    "max_depth": 4,
    "total_spawned": 0
  },
  "cycles": {
    "current_attempt": 1,
    "max_attempts": 3,
    "active_loop": "none",
    "one_shot_escalations": {
      "requirements_gap_n5_n3b": false,
      "architecture_drift_n5_n3c": false
    },
    "loop_history": []
  },
  "running_sub_agents": [],
  "artifacts": {
    "agents_md": {
      "path": "AGENTS.md",
      "type": "law_book",
      "role": "orchestrator",
      "created_at": "2026-07-06T08:00:00Z"
    }
  },
  "memory": {
    "active": [
      {
        "id": "mem-sem-001",
        "layer": "semantic",
        "scope": "project",
        "trust": "trusted",
        "source": "AGENTS.md",
        "summary": "Projekt-Verfassung: 9 Gesetze, DoD via ausführbare Nachweise",
        "created_at": "2026-07-06T08:00:00Z",
        "last_validated_at": "2026-07-06T08:00:00Z"
      },
      {
        "id": "mem-proc-001",
        "layer": "procedural",
        "scope": "global",
        "trust": "trusted",
        "source": "workflow-cfg.md",
        "summary": "CFG-Ablauf N0..N7 mit Memory-Gates an N1/N7",
        "created_at": "2026-07-06T08:00:00Z",
        "last_validated_at": "2026-07-06T08:00:00Z"
      }
    ],
    "pending_writes": [],
    "poisoning_checks": {
      "source_validated": true,
      "session_isolated": true,
      "integrity_baseline": true,
      "injection_scan": "passed",
      "policy_action": "allow"
    },
    "store": {
      "backend": "cursor_memories",
      "namespace": "agent-rules"
    }
  },
  "dod_gates": {
    "N0": {
      "status": "passed",
      "proof_type": "manual_waiver",
      "verified_at": "2026-07-06T08:00:00Z"
    },
    "N1": { "status": "pending" },
    "N2": { "status": "pending" }
  },
  "blockers": [],
  "context_budget": {
    "orchestrator_utilization_percent": 12,
    "handover_threshold_percent": 80
  },
  "timestamps": {
    "created_at": "2026-07-06T08:00:00Z",
    "updated_at": "2026-07-06T08:00:00Z"
  }
}
